{
  "$schema": "https://json-schema.org/draft/2020-12/schema",
  "$id": "https://endfield-dijiang-optimizer.local/schemas/scenario.schema.json",
  "title": "Optimization Scenario",
  "type": "object",
  "required": [
    "scenarioFormatVersion",
    "catalogVersion",
    "roster",
    "facilities",
    "options"
  ],
  "properties": {
    "scenarioFormatVersion": {
      "type": "integer",
      "const": 1
    },
    "catalogVersion": {
      "type": "string"
    },
    "roster": {
      "type": "array",
      "items": {
        "type": "object",
        "required": [
          "operatorId",
          "owned",
          "level",
          "promotionTier",
          "baseSkillStates"
        ],
        "properties": {
          "operatorId": { "type": "string" },
          "owned": { "type": "boolean" },
          "level": { "type": "integer", "minimum": 1, "maximum": 90 },
          "promotionTier": { "type": "integer", "minimum": 0, "maximum": 4 },
          "baseSkillStates": {
            "type": "array",
            "items": {
              "type": "object",
              "required": [
                "skillId",
                "unlockedRank"
              ],
              "properties": {
                "skillId": { "type": "string" },
                "unlockedRank": { "type": "integer", "minimum": 0, "maximum": 2 }
              },
              "additionalProperties": false
            }
          },
          "skportSnapshot": {
            "type": "object",
            "required": ["sourceOperatorId", "gear", "combatSkills"],
            "properties": {
              "sourceOperatorId": { "type": "string" },
              "potentialLevel": { "type": "number" },
              "weapon": {
                "type": "object",
                "required": ["id"],
                "properties": {
                  "id": { "type": "string" },
                  "name": { "type": "string" },
                  "level": { "type": "number" },
                  "refinementLevel": { "type": "number" },
                  "breakthroughLevel": { "type": "number" }
                },
                "additionalProperties": false
              },
              "gear": {
                "type": "array",
                "items": {
                  "type": "object",
                  "required": ["slot", "id"],
                  "properties": {
                    "slot": { "type": "string", "enum": ["body", "arm", "accessory_1", "accessory_2"] },
                    "id": { "type": "string" },
                    "name": { "type": "string" },
                    "level": { "type": "string" },
                    "rarity": { "type": "string" },
                    "setName": { "type": "string" }
                  },
                  "additionalProperties": false
                }
              },
              "tacticalItem": {
                "type": "object",
                "required": ["id"],
                "properties": {
                  "id": { "type": "string" },
                  "name": { "type": "string" },
                  "rarity": { "type": "string" }
                },
                "additionalProperties": false
              },
              "combatSkills": {
                "type": "array",
                "items": {
                  "type": "object",
                  "required": ["id", "level"],
                  "properties": {
                    "id": { "type": "string" },
                    "level": { "type": "number" },
                    "maxLevel": { "type": "number" }
                  },
                  "additionalProperties": false
                }
              }
            },
            "additionalProperties": false
          }
        },
        "additionalProperties": false
      }
    },
    "rosterImport": {
      "type": "object",
      "required": [
        "provider",
        "importedAt",
        "sourceOperatorCount",
        "matchedOperatorCount",
        "completeRoster"
      ],
      "properties": {
        "provider": { "const": "skport" },
        "importedAt": { "type": "string", "format": "date-time" },
        "sourceSavedAt": { "type": "string", "format": "date-time" },
        "sourceOperatorCount": { "type": "integer", "minimum": 0 },
        "matchedOperatorCount": { "type": "integer", "minimum": 0 },
        "completeRoster": { "type": "boolean" },
        "inventory": {
          "type": "object",
          "required": ["weapons", "gear", "tacticalItems"],
          "properties": {
            "weapons": {
              "type": "array",
              "items": { "$ref": "#/$defs/skportInventoryEntry" }
            },
            "gear": {
              "type": "array",
              "items": { "$ref": "#/$defs/skportInventoryEntry" }
            },
            "tacticalItems": {
              "type": "array",
              "items": { "$ref": "#/$defs/skportInventoryEntry" }
            },
            "materials": {
              "type": "array",
              "items": {
                "type": "object",
                "required": ["id", "ownedCount"],
                "properties": {
                  "id": { "type": "string", "minLength": 1 },
                  "name": { "type": "string", "minLength": 1 },
                  "ownedCount": { "type": "integer", "minimum": 0 }
                },
                "additionalProperties": false
              }
            }
          },
          "additionalProperties": false
        }
      },
      "additionalProperties": false
    },
    "facilities": {
      "type": "object",
      "required": [
        "controlNexus",
        "manufacturingCabins",
        "growthChambers",
        "hardAssignments"
      ],
      "properties": {
        "controlNexus": {
          "type": "object",
          "required": [
            "level"
          ],
          "properties": {
            "level": { "type": "integer", "minimum": 1, "maximum": 5 }
          },
          "additionalProperties": false
        },
        "manufacturingCabins": {
          "type": "array"
        },
        "growthChambers": {
          "type": "array"
        },
        "receptionRoom": {
          "type": "object"
        },
        "hardAssignments": {
          "type": "array",
          "items": {
            "type": "object",
            "required": [
              "operatorId",
              "roomId"
            ],
            "properties": {
              "operatorId": { "type": "string" },
              "roomId": { "type": "string" },
              "shift": { "enum": ["A", "B"] }
            },
            "additionalProperties": false
          }
        }
      },
      "additionalProperties": false
    },
    "options": {
      "type": "object",
      "required": [
        "maxFacilities",
        "upgradeRankingMode"
      ],
      "properties": {
        "maxFacilities": { "type": "boolean" },
        "shiftRotation": {
          "type": "object",
          "required": ["enabled"],
          "properties": {
            "enabled": { "type": "boolean" },
            "scheduleMode": { "enum": ["optimized", "fixed"] },
            "schedules": {
              "type": "object",
              "additionalProperties": { "$ref": "#/$defs/shiftSchedule" }
            }
          },
          "additionalProperties": false
        },
        "upgradeRankingMode": {
          "type": "string",
          "enum": [
            "fastest",
            "roi",
            "balanced"
          ]
        }
      },
      "additionalProperties": false
    }
  },
  "additionalProperties": false,
  "$defs": {
    "shiftSchedule": {
      "type": "object",
      "required": ["startMinute", "endMinute"],
      "properties": {
        "startMinute": { "type": "integer", "minimum": 0, "maximum": 1380, "multipleOf": 60 },
        "endMinute": { "type": "integer", "minimum": 0, "maximum": 1380, "multipleOf": 60 }
      },
      "additionalProperties": false
    },
    "skportInventoryEntry": {
      "type": "object",
      "required": ["id", "ownedCount"],
      "properties": {
        "id": { "type": "string", "minLength": 1 },
        "name": { "type": "string", "minLength": 1 },
        "ownedCount": { "type": "integer", "minimum": 1 }
      },
      "additionalProperties": false
    }
  }
}
