{
  "scenarioFormatVersion": 1,
  "catalogVersion": "2026-03-20/v1.1-phase1",
  "roster": [
    {
      "operatorId": "chen-qianyu",
      "owned": true,
      "level": 40,
      "promotionTier": 1,
      "baseSkillStates": [
        {
          "skillId": "blade-critique",
          "unlockedRank": 1
        },
        {
          "skillId": "jadeworking",
          "unlockedRank": 1
        }
      ]
    },
    {
      "operatorId": "xaihi",
      "owned": true,
      "level": 30,
      "promotionTier": 0,
      "baseSkillStates": [
        {
          "skillId": "standardized-scripting",
          "unlockedRank": 1
        }
      ]
    },
    {
      "operatorId": "snowshine",
      "owned": true,
      "level": 20,
      "promotionTier": 0,
      "baseSkillStates": [
        {
          "skillId": "rescuers-perseverance",
          "unlockedRank": 0
        },
        {
          "skillId": "happy-go-lucky",
          "unlockedRank": 0
        }
      ]
    }
  ],
  "facilities": {
    "controlNexus": {
      "level": 5
    },
    "manufacturingCabins": [
      {
        "id": "mfg-1",
        "enabled": true,
        "level": 3,
        "fixedRecipeId": "advanced-cognitive-carrier"
      },
      {
        "id": "mfg-2",
        "enabled": true,
        "level": 3,
        "fixedRecipeId": "arms-insp-set"
      }
    ],
    "growthChambers": [
      {
        "id": "growth-1",
        "enabled": true,
        "level": 3,
        "fixedRecipeIds": [
          "kalkonyx",
          "auronyx",
          "umbronyx",
          "kalkodendra",
          "chrysodendra",
          "vitrodendra",
          "pink-bolete",
          "red-bolete",
          "ruby-bolete"
        ]
      }
    ],
    "receptionRoom": {
      "id": "reception-1",
      "enabled": true,
      "level": 3
    },
    "hardAssignments": []
  },
  "options": {
    "maxFacilities": true,
    "upgradeRankingMode": "balanced"
  }
}
